{
  "phase_index": 2,
  "training": {
    "avg_reward": -4.411363636363638,
    "success_rate": 0.0,
    "avg_steps": 35.61818181818182,
    "mean_td_error": 0.2219559007902986,
    "final_epsilon": 0.05
  },
  "evaluation": {
    "avg_reward": -3.750000000000002,
    "success_rate": 0.0,
    "avg_steps": 45
  },
  "learning_rate": 0.052500000000000005,
  "gamma": 0.96,
  "epsilon_start": 1.0,
  "epsilon_decay": 0.97515,
  "episodes_per_phase": 220,
  "q_table_size": 33,
  "benchmark": {
    "reward_delta_vs_previous": 0.0,
    "success_delta_vs_previous": 0.0,
    "reward_delta_vs_best": 0.0,
    "success_delta_vs_best": 0.0,
    "noise_floor": 0.0,
    "confidence_score": 0.0,
    "passes_confidence_gate": false
  },
  "checks": {
    "passed": true,
    "passed_checks": [
      "phase_metrics_schema",
      "checkpoint_load",
      "standalone_play_smoke"
    ],
    "failed_checks": []
  },
  "adjustments": [
    "Evaluation plateau detected.",
    "Exploration looks exhausted: boost epsilon_start and relax epsilon decay.",
    "Reduce learning rate to stabilize value updates."
  ],
  "journal_event_id": "20260331T120223769485Z-seed7:phase:2"
}