{
  "phase_index": 3,
  "training": {
    "avg_reward": -1.3200000000000003,
    "success_rate": 0.2636363636363636,
    "avg_steps": 18.536363636363635,
    "mean_td_error": 0.6524080131904124,
    "final_epsilon": 0.05
  },
  "evaluation": {
    "avg_reward": 10.5,
    "success_rate": 1.0,
    "avg_steps": 10
  },
  "learning_rate": 0.03937500000000001,
  "gamma": 0.96,
  "epsilon_start": 1.0,
  "epsilon_decay": 0.9849015,
  "episodes_per_phase": 220,
  "q_table_size": 33,
  "adjustments": [
    "Performance improved: slightly raise learning rate and tighten exploration decay.",
    "Long-horizon behavior improved: increase gamma a little."
  ]
}