{
  "phase_index": 0,
  "training": {
    "avg_reward": -5.199375000000001,
    "success_rate": 0.020833333333333332,
    "avg_steps": 30.004166666666666,
    "mean_td_error": 3.7069999324866685,
    "final_epsilon": 0.14547933828862347
  },
  "evaluation": {
    "avg_reward": -3.750000000000002,
    "success_rate": 0.0,
    "avg_steps": 45
  },
  "learning_rate": 0.03,
  "gamma": 0.97,
  "epsilon_start": 1.0,
  "epsilon_decay": 0.992,
  "episodes_per_phase": 240,
  "q_table_size": 33,
  "adjustments": [
    "Bootstrap phase: keep initial hyperparameters."
  ]
}