{
  "phase_index": 3,
  "training": {
    "avg_reward": -1.3200000000000003,
    "success_rate": 0.2636363636363636,
    "avg_steps": 18.536363636363635,
    "mean_td_error": 0.6524080131904124,
    "final_epsilon": 0.05
  },
  "evaluation": {
    "avg_reward": 10.5,
    "success_rate": 1.0,
    "avg_steps": 10
  },
  "learning_rate": 0.03937500000000001,
  "gamma": 0.96,
  "epsilon_start": 1.0,
  "epsilon_decay": 0.9849015,
  "episodes_per_phase": 220,
  "q_table_size": 33,
  "benchmark": {
    "reward_delta_vs_previous": 14.250000000000002,
    "success_delta_vs_previous": 1.0,
    "reward_delta_vs_best": 14.250000000000002,
    "success_delta_vs_best": 1.0,
    "noise_floor": 0.3749999999999989,
    "confidence_score": 38.00000000000012,
    "passes_confidence_gate": true
  },
  "checks": {
    "passed": true,
    "passed_checks": [
      "phase_metrics_schema",
      "checkpoint_load",
      "standalone_play_smoke"
    ],
    "failed_checks": []
  },
  "adjustments": [
    "Performance improved: slightly raise learning rate and tighten exploration decay.",
    "Long-horizon behavior improved: increase gamma a little."
  ],
  "journal_event_id": "20260331T120223769485Z-seed7:phase:3"
}