{
  "phase_index": 0,
  "training": {
    "avg_reward": 0.24409090909090886,
    "success_rate": 0.37727272727272726,
    "avg_steps": 22.186363636363637,
    "mean_td_error": 0.6122677077178789,
    "final_epsilon": 0.10958290556334822
  },
  "evaluation": {
    "avg_reward": -4.5,
    "success_rate": 0.0,
    "avg_steps": 45
  },
  "learning_rate": 0.05,
  "gamma": 0.95,
  "epsilon_start": 1.0,
  "epsilon_decay": 0.99,
  "episodes_per_phase": 220,
  "q_table_size": 33,
  "benchmark": {
    "reward_delta_vs_previous": 0.0,
    "success_delta_vs_previous": 0.0,
    "reward_delta_vs_best": 0.0,
    "success_delta_vs_best": 0.0,
    "noise_floor": 0.0,
    "confidence_score": 0.0,
    "passes_confidence_gate": true
  },
  "checks": {
    "passed": true,
    "passed_checks": [
      "phase_metrics_schema",
      "checkpoint_load",
      "standalone_play_smoke"
    ],
    "failed_checks": []
  },
  "adjustments": [
    "Bootstrap phase: keep initial hyperparameters."
  ],
  "journal_event_id": "20260331T120223769485Z-seed7:phase:0"
}